{"schemaVersion":1,"product":"IERS Bulletin A finals2000A Earth orientation","timeScale":"UTC","units":{"mjdUtc":"day","dut1":"second","dut1ReportedError":"second","polarMotion":"arcsecond","polarMotionReportedError":"arcsecond"},"source":{"title":"IERS Bulletin A finals2000A","url":"https://maia.usno.navy.mil/ser7/finals2000A.all","formatUrl":"https://maia.usno.navy.mil/ser7/readme.finals2000A","checksumUrl":"https://maia.usno.navy.mil/ser7/checksums.sha512","productMetadataUrl":"https://datacenter.iers.org/versionMetadata.php?filename=latestVersionMeta%2F9_FINALS.ALL_IAU2000_V2013_019.txt","retrievedAt":"2026-07-30T23:12:41.229Z","sourceLastModified":"2026-07-30T17:43:11.000Z","sourceSha256":"4b828090fc94114168014b61439fa5e6ec0bdfda518075a32baffea90110954d","officialSourceSha512":"ab5d92505408dbe5f7900dcc1068c445dcc1227d2078c9623fd2c5a6804adefde59d3c564d08c8df150103f0a41938559774980e734ddfb9fca3fcc42f6506d8","formatSha256":"3efb2c610012360391aed5c057489ff74539b78494a66b7f9b342d1843db9254","checksumSha256":"783ebc9288a38cee0c1a96bbf68d1724447815fde62c8502b3c007bfad50a279","attribution":"IERS Rapid Service/Prediction Center at USNO","distributionStatement":"Distribution Statement A. Approved for public release: distribution unlimited.","distributionUrl":"https://maia.usno.navy.mil/products/daily","rawSnapshot":"shared/eop/source/finals2000A.all","formatSnapshot":"shared/eop/source/readme.finals2000A","checksumSnapshot":"shared/eop/source/checksums.sha512","reportedErrorSemantics":"The source labels these columns as error; no confidence level or covariance is asserted."},"statusCodes":{"I":"iers","P":"predicted"},"encoding":{"mjdUtc":"chunk.startMjdUtc + zero-based record index","numeric":"each series stores its first absolute integer followed by signed daily deltas","dut1IntegerUnit":"microsecond","polarMotionIntegerUnit":"microarcsecond","quality":"independent DUT1 and polar-motion ranges are [startOffset, endOffsetExclusive, I|P]","maximumDut1QuantizationErrorSeconds":5e-7,"maximumPolarMotionQuantizationErrorArcseconds":5e-7,"canonicalRecordColumns":["mjdUtc","polarMotionStatus","xpMicroarcseconds","xpReportedErrorMicroarcseconds","ypMicroarcseconds","ypReportedErrorMicroarcseconds","dut1Status","dut1Microseconds","dut1ReportedErrorMicroseconds"]},"coverage":{"firstSampleMjdUtc":41684,"lastSampleMjdUtc":61624,"recordCount":19941,"sourceRowCount":19991,"polarMotion":{"iersThroughMjdUtc":61251,"predictionStartsMjdUtc":61252,"iersCount":19568,"predictedCount":373,"missingTailRows":50},"dut1":{"iersThroughMjdUtc":61251,"predictionStartsMjdUtc":61252,"iersCount":19568,"predictedCount":373,"missingTailRows":50,"leapSecondBoundaryCount":25}},"chunks":[{"file":"shared/eop/eop/41684.v1.json","startMjdUtc":41684,"endMjdUtc":45779,"recordCount":4096,"polarMotionIersCount":4096,"polarMotionPredictedCount":0,"dut1IersCount":4096,"dut1PredictedCount":0,"rawBytes":109788,"gzipBytes":42608,"sha256":"8d83f6f1dfedb0e7abcdd32971b83f8ed4725cf51eec01618db9ece8ad212a51"},{"file":"shared/eop/eop/45780.v1.json","startMjdUtc":45780,"endMjdUtc":49875,"recordCount":4096,"polarMotionIersCount":4096,"polarMotionPredictedCount":0,"dut1IersCount":4096,"dut1PredictedCount":0,"rawBytes":103944,"gzipBytes":41058,"sha256":"055ca3054810ebb3247c2a7a66f05d7cf7033ae99f2ffa3932ee70a37eba43d2"},{"file":"shared/eop/eop/49876.v1.json","startMjdUtc":49876,"endMjdUtc":53971,"recordCount":4096,"polarMotionIersCount":4096,"polarMotionPredictedCount":0,"dut1IersCount":4096,"dut1PredictedCount":0,"rawBytes":95403,"gzipBytes":36723,"sha256":"55deedd612724c957900e302658dcd6efa7ba3b25774f23c64cc6bbff5ad3f0b"},{"file":"shared/eop/eop/53972.v1.json","startMjdUtc":53972,"endMjdUtc":58067,"recordCount":4096,"polarMotionIersCount":4096,"polarMotionPredictedCount":0,"dut1IersCount":4096,"dut1PredictedCount":0,"rawBytes":93569,"gzipBytes":34549,"sha256":"8d9a7b359251559568b7861beade21855311243cb28c6477a239b4ec0c1fc028"},{"file":"shared/eop/eop/58068.v1.json","startMjdUtc":58068,"endMjdUtc":61624,"recordCount":3557,"polarMotionIersCount":3184,"polarMotionPredictedCount":373,"dut1IersCount":3184,"dut1PredictedCount":373,"rawBytes":78301,"gzipBytes":29395,"sha256":"6068a25b2a800aced0e534ee159bfbbedeee42f8c8b7a44da5e5174d083dae38"}]}
